topic,summary,new_summary
0.0,"The commenter shares a story about a customer who wanted a free iPhone 5 when it came out, but the company's policy states that before an escalation to a supervisor, the customer must have a verified account. The commenter suggests that the customer's behavior was unacceptable and that the company should have~~The commenter shared a story about their grandmother's switchboard operator days where a customer kept calling in and the operator would respond with a six-inch willy. The commenter used to do phone audits on call center staff and had to listen through the person being on hold to avoid missing any calls.~~The commenter had a bad experience with a customer who kept talking about how he discovered something that was going to turn computing on its head. The commenter didn't care about the average handle time and didn't want to deal with the customer's behavior. They also had a bad experience with~~The commenter empathizes with the poster's situation and suggests that the poster should not have given out their personal phone number. They also share a personal experience of dealing with customers who were rude and entitled.~~The commenter shares a personal experience of receiving angry voicemails from their older brother, who was enrolled in a med school program at the time. The commenter empathizes with their brother's frustration and explains that they work in customer service for a food delivery company and often receive angry voicemails from customers~~The commenter doesn't understand why people rant at call center employees, as they know they have limited power and don't have the ability to fix complex issues. They suggest being nice to the call center employees when dealing with an issue, as it's possible to hate the company and not","The commenter shares a story about a customer who wanted a free iPhone 5 when it came out, but the company's policy states that before an escalation to a supervisor, the customer must have a verified account. The commenter empathizes with the poster's situation and suggests that the poster should not have given out their personal phone number. They also share a personal experience of receiving angry voicemails from their older brother, who was enrolled in a med school program at the time. The commenter empathizes with their brother's frustration and explains that they work in customer service for a food delivery company and often receive angry voicemails from customers."
1.0,"The commenter shares a personal experience of a customer who was overdrawn on their new account. The commenter reassures the customer that it's not their fault and that the bank had some bad practices. They also share a story about a customer who threatened to sue the bank if they didn't~~The commenter explains that they will always comply with a customer's request to cancel their free membership with them because they didn't give in to their demands. They also mention that a customer's request for an internet installation was unreasonable and that the customer may have had their credit card compromised.~~The commenter shares a personal experience of being on the phone for three hours with a customer who acted entitled and refused to take responsibility for their actions. They express frustration with the customer's behavior and suggest that big businesses should take action against entitled customers. They also share a humorous anecdote about a customer~~The commenter had a difficult interaction with a mother who wanted to send her daughter's medical bills in her daughter's name instead of her daughter's name because she is a legal adult and is responsible for all her daughter's finances. The supervisor told the mother that it was not possible~~The commenter worked at a large American bank and had a fire alarm go off in their office. They were able to connect with someone in another center and were relieved that the customer didn't need to provide any personal information. They also express frustration with customers who don't take responsibility for their~~The commenter works for a utility company and frequently receives phone calls from customers who want to change their cell phone plans. They suggest asking the person on the phone for their email address, assuming they work for the same company as the CEO or VP of something. They also mention that they have had to",The commenter shares a personal experience of a customer who was overdrawn on their new account. They reassure the customer that it's not their fault and that the bank had some bad practices. They also share a story about a customer who threatened to sue the bank if they didn't. They also mention that a customer's request for an internet installation was unreasonable and that the customer may have had their credit card compromised.The commenter shares a personal experience of being on the phone for three hours with a customer who acted entitled and refused to take responsibility for their actions. They express frustration with the customer's behavior and suggest that big businesses should take action against entitled customers. They also share a humorous anecdote about a customer who wanted to send her daughter's medical bills in her daughter's name instead of her daughter's name because she is a legal adult and is responsible for all her daughter's finances.
2.0,"The commenter had a bad experience with a customer who wanted to buy a car with a trash record and didn't want to pay for it. They didn't want to deal with the customer's behavior and didn't want to waste their time dealing with the issue. The commenter also~~The commenter had a bad experience with customer service when their baby was born, but they were able to remain calm and communicate with the representative. They also mention that their previous company had a similar policy of giving three warnings to abusive customers and giving them time off if they get worked up. The commenter~~The commenter expresses frustration with customers who don't provide any information about their orders, especially when it comes to the supply chain issue. They also mention that they have had customers complain about the company's handling of their orders, but have been able to resolve the issue through escalation. They also~~The commenter dislikes members and customers who complain about receiving discounts or other benefits because they lack understanding of chemistry, biology, or any science. They also dislike customers who threaten to call the store if they don't get what they want. The commenter used to work in a credit union call center and~~The commenter, who works in electronics, is frustrated with customers who complain about price increases despite not ordering since 2018. They also express frustration with customers who complain about the company's handling of their orders and suggest that the customer should not have reported the incident to the police. They also criticize customers who~~The commenter found an exceptional Sony TV for just $300 on an online store, but when they called the company to ask for details, they were told that the model was removed from the web site until they could adjust the price. The commenter expresses frustration with the company's invasion of privacy policy and",The commenter had a bad experience with a customer who wanted to buy a car with a trash record and didn't want to pay for it. They didn't want to deal with the customer's behavior and didn't want to waste their time dealing with the issue. They mention that their previous company had a similar policy of giving three warnings to abusive customers and giving them time off if they get worked up. They also express frustration with customers who complain about the company's handling of their orders and suggest that the customer should not have reported the incident to the police.
3.0,"The commenter received a call from someone asking if their phone bill could be left at the corner for them to pick up or if they could meet the mailman somewhere to get it. When the commenter asked why they needed it done, the person said they didn't want their wife to see it~~The commenter had a customer call in with enough credits to keep his bill paid for the next three months, but the customer wanted more. The commenter believes that customer service agents should have the power to call out problem customers and warn them that they are a liability for the company they work for. They~~The commenter had a manager call where the caller demanded to speak to a manager after 45 minutes of them telling him they were in the wrong department for his query. The commenter ended up offline for the rest of the day because it was too stressful and the caller didn't know how to handle the~~The commenter had a bad experience with a customer who wanted them to come back to pick up their trash. The customer initially claimed to have picked up their card from the front desk, but later informed them that it was actually rolled up in a receipt. The commenter was frustrated with the customer's~~The commenter shares a personal experience of being threatened with a lawyer by a customer who falsely claimed to be a doctor. They also mention a TV program about insurance fraud and how dishonest customers can be. The commenter also criticizes customers who use the phrase ""the customer is always right"" and suggests that~~The commenter expresses frustration with people who assume that a police report or case number is the same as a claim. They also share their own experience of being referred for fraud by an insured who falsely claimed that a hurricane blew a barrel off of their vehicle. The commenter also shares a personal experience of being","The commenter received a call from someone asking if their phone bill could be left at the corner for them to pick up or if they could meet the mailman somewhere to get it. When the commenter asked why they needed it done, the person said they didn't want their wife to see it. The commenter had a customer call in with enough credits to keep their bill paid for the next three months, but the customer wanted more. The commenter believes that customer service agents should have the power to call out problem customers and warn them that they are a liability for the company they work for. The commenter had a manager call where the caller demanded to speak to a manager after 45 minutes of them telling him they were in the wrong department for his query. The commenter ended up offline for the rest of the day because it was too stressful and the caller didn't know how to handle theThe commenter had a bad experience with a customer who wanted them to come back to pick up their trash."
4.0,"The commenter believes that the situation described in the post is not unreasonable due to the fact that the system is broken. They also express frustration with the customer's behavior and suggest that the customer should have waited for the next appointment instead of lying to call center staff. The commenter also criticizes the~~The commenter is a customer service representative (CSR) who is frustrated with customers who don't have enough knowledge and don't want to know what's going on. They also mention that some customers are willing to wait until the end of the year to book appointments, even if it means~~The commenter works in a pharmacy and finds it difficult to communicate with customers who don't listen to voicemails. They share a personal experience of a family member who was told to take all of her medication, eat a low-salt diet, and exercise three days a week. The commenter also~~The commenter used to work as a customer service representative for a home alarm system and had to deal with customers who didn't put in the code after a minute. They express frustration with customers who don't understand the difference between deductible, copayments, and coinsurance.~~The commenter empathizes with a 96-year-old woman who thinks she has to physically take her money out of her old bank account to move it to a new one. The commenter also shares their own experience of being called a ""dumb bitch"" by a pharmacy employee who didn't~~The commenter's last job had people calling asking for a list of all of the doctors in the country that took the insurance, but the organization didn't have enough paper to print and mail them. The commenter explains that their call-back system is similar to the automatic call system, and","The commenter believes that the situation described in the post is not unreasonable due to the fact that the system is broken. They express frustration with the customer's behavior and suggest that the customer should have waited for the next appointment instead of lying to call center staff. The commenter also criticizes customers who don't have enough knowledge and don't want to know what's going on. They share a personal experience of a family member who was told to take all of her medication, eat a low-salt diet, and exercise three days a week. They express frustration with customers who don't understand the difference between deductible, copayments, and coinsurance. The commenter empathizes with a 96-year-old woman who thinks she has to physically take her money out of her old bank account to move it to a new one. The commenter also shares their own experience of being called a ""dumb bitch"" by a pharmacy employee who didn't."
5.0,"The commenter had a similar experience with a customer who was trying to add their car to their wife's policy, but the advisor wouldn't allow them to speak to the customer's wife. The commenter believes that the customer's behavior was unacceptable and that the advisor should be held accountable~~The commenter had a car towed home due to a late night and an older car that may go to any number of shops depending on the issue. The person on the other end of the line was rude and didn't want the commenter's food back. The commenter had a negative experience with~~The commenter empathizes with the situation described in the post and suggests that filing a missing person's report would have helped if the nephew had been involved in a car accident. They also express frustration with the customer's behavior and suggest that they could have handled the situation better. The commenter also~~The commenter used to work in commercial auto insurance and had to deal with customers who didn't understand the difference between a car and a trailer. They also had to deal with customers who didn't understand the difference between a plow blade and a socket wrench, and had to ask for the customer~~The commenter had a call with someone trying to do a settlement and explained that they were not sympathetic to their situation. The person on the other end of the line tried to plead their case to management, but the commenter told them that they were a horrible CSR and that the person on the other end~~The commenter explains that in a truck yard, spots are mapped out for easy navigation, but the driver didn't find the container he was supposed to find in spot X. The commenter also shares a personal experience where a customer's car broke down and they had to rely on a tow truck","The commenter had a similar experience with a customer who was trying to add their car to their wife's policy, but the advisor wouldn't allow them to speak to the customer's wife. The commenter believes that the customer's behavior was unacceptable and that the advisor should be held accountable. The commenter empathizes with the situation described in the post and suggests that filing a missing person's report would have helped if the nephew had been involved in a car accident. They also express frustration with the customer's behavior and suggest that they could have handled the situation better. The commenter also shares a personal experience where a customer's car broke down and they had to rely on a tow truck."
6.0,"The commenter worked for a mobile company and had to deal with customers who broke their phone in the parking lot and still had to pay for it. They had to explain multiple times why they still had to pay for it and offer insurance, but the customers still refused to pay. The commenter had to~~The commenter works in telecommunications and often receives calls from customers who want to upgrade their phones for free, but the system won't let them until their past due balance is cleared. The commenter suggests that the customer should call back to complain about the high bill. They also suggest that the customer~~The commenter used to work in the wireless industry and shared a story about a co-worker who switched to Spanish after speaking fluent Spanish for the first time. The commenter is glad to have quit the industry and thinks it's unfair for employees to lie to customers. They also express frustration with customers~~The commenter works for an ISP and is trying to figure out how they would handle a customer who claimed to have a locked phone. They suggest that the customer should call the ISP to see if they can unlock the phone for free. They also share a personal experience of dealing with a customer who claimed~~The commenter shares a personal experience of dealing with a colleague who lied on his credit card and overdraft application. The commenter advises customers to pay their phone bill in full and on time. They also express frustration with customers who try to change their phone plans and complain about long wait times for tech support.~~The commenter used to work for a retail store and had a bad experience with a customer who didn't want to pay for a new credit card terminal because it was outside of warranty. The commenter believes that the customer's behavior reflects poorly on the company's retention policy and suggests that the","The commenter worked for a mobile company and had to deal with customers who broke their phone in the parking lot and still had to pay for it. They had to explain multiple times why they still had to pay for it and offer insurance, but the customers refused to pay. The commenter suggests that the customer should call back to complain about the high bill. They also express frustration with customers who try to change their phone plans and complain about long wait times for tech support."
7.0,"The commenter advises bypassing the incompetent manager and going straight to HR to report any instances of harassment. They suggest posting on r/legaladvice or r/legaladviceuk to get advice on moving forward. They also share their own experience of working at a call center and how it can be difficult to~~The commenter sympathizes with the OP's situation and suggests documenting everything and speaking to HR immediately if the culture is toxic. They also share a personal experience of working at a call center where a coworker passed away, and suggest seeking help from the National Suicide Prevention Lifeline at 1-800-273-8255 or~~The commenter had a bad experience with a customer who gave them a bad review because they didn't have an authorized user on the account. They had to go on break and smoke a few cigarettes after being clean for a few months, and had to deal with being treated like an adult. They~~The commenter believes that quitting a call center job is the best decision one can make for their mental health. They also mention that they had a bad experience working at a call center and had to take a pay cut to get out of a bad situation. They also express frustration with the job market and~~The commenter sympathizes with the original poster's experience of working in a call center and believes that they are excellent at what they do. They also express frustration with the stress of job searching and suggest that the poster should consider moving to a new department or taking a pay cut if they want to~~The commenter had a bad experience working in a call center for two months and is now looking for a new job. They mention that they were forced to work in a call center because there wasn't enough staff and that they are still recovering from the long-term effects of extreme anxiety. They~~The commenter believes that the person made the best choice for their health and that no job should come at the expense of their health. They share their own experience of not being paid enough to return to a job where their health was the most important factor.","The commenter advises bypassing the incompetent manager and going straight to HR to report any instances of harassment. They also share their own experience of working at a call center where a coworker passed away and suggest documenting everything and speaking to HR immediately if the culture is toxic. They also share a personal experience of working at a call center where a coworker passed away, and suggest seeking help from the National Suicide Prevention Lifeline at 1-800-273-8255 or the commenter had a bad experience with a customer who gave them a bad review because they didn't have an authorized user on the account. They also express frustration with the job market and suggest that the poster should consider moving to a new department or taking a pay cut if they want to."
8.0,"The commenter sympathizes with the original poster's experience of being called ""ugly"" for trying to help a customer who didn't want an interpreter. They also mention that they work for a shoe company and offer services to customers who have a high level of English. They also mention that they~~The commenter expresses frustration with customers who speak poorly in a foreign language and suggests that they should take responsibility for their own language skills. They also share their own experience of working at an American outsourced call center where they were the only female supervisor.~~The commenter worked as a customer service representative for a military-affiliated bank and had a customer who had a Hispanic accent. The commenter had to ask the customer to speak to someone English because they didn't understand the customer's accent. The commenter also had to ask a customer to speak to~~The commenter shares their experience of working as an on-phone Spanish translator and notes that sometimes Spanish speakers come up with words that don't make sense, such as ""Gua Gua"" for a bus. They suggest giving a verbal or written warning if it's a recurring occurrence and caution against~~The commenter shares their experience of dealing with rude callers from New York and New Jersey. They also mention that if a call comes in from the 626 area code, they will let it bounce. They also share their own experience of dealing with rude callers while working in a call center.","The commenter sympathizes with the original poster's experience of being called ""ugly"" for trying to help a customer who didn't want an interpreter. They also mention that they work for a shoe company and offer services to customers who have a high level of English. They also share their own experience of working at an American outsourced call center where they were the only female supervisor. They also share their own experience of dealing with rude callers while working in a call center."
9.0,"The commenter worked in retail for 10 years and was promoted to a call center job where they dealt with angry customers for 2 1/2 years. They quit their job and told their wife to apply for another job with similar pay and better environment. They also shared their own experience of quitting their call center job~~The commenter suggests that the person interviewing for a call center job should provide a hypothetical case where they went above and beyond to help a customer. They also mention that some people in the call center may not have the necessary knowledge and experience to handle difficult situations. The commenter advises not to worry about low~~The commenter had a recording of two difficult phone calls they had monitored and asked the applicants to critique them. They also had a laminated printout with a fake account number, a description of the service the customer had, and a fake customer name and address. The commenter appreciated the call center staff's~~The commenter worked in a call center for six months and found it to be a difficult place to work due to understaffing and poor customer service. However, they believe that long-term karma can be beneficial as it can lead to better pay and benefits in the future. They encourage others to~~The commenter shares their experience of working from home for a large insurance company, where they had a meltdown and smashed their headset on the ground. They also mention that working from home can be mentally draining and that they prioritize documenting their mental health rather than spending time with customers. They also mention that they~~The commenter shares their experience of working in a call center, where they were fired after two months and eventually ended up in client services. They advise the poster to channel their frustration into motivation by focusing on their customer service skills and not letting management get in the way. They also share their own experience",The commenter worked in retail for 10 years and was promoted to a call center job where they dealt with angry customers for 2 1/2 years. They quit their job and told their wife to apply for another job with similar pay and better environment. They also shared their own experience of quitting their call center job and advised others to channel their frustration into motivation by focusing on their customer service skills and not letting management interfere.
