topic,summary,new_summary
10.0,"The commenter witnessed a confrontation between a hotel guest and the night manager, who refused to upgrade the guest's room to a suite or allow them to stay for free. The commenter sympathized with the guest's situation and suggested that the hotel could have accommodated the guest's request for a~~The commenter sympathizes with the original poster's experience of dealing with a rude customer and suggests that the hotel should put a loyalty page on their website to avoid any discussion. They also express frustration with the customer's behavior and suggest that the hotel should offer a discount to appease the customer.~~The commenter's sister worked as a call center agent for a booking website and dealt with some odd calls where customers would get abusive because she couldn't help them plan vacations to places like Middle Earth or her favorite- a woman who was adamant they could help her book a flight to Kenya and~~The commenter used to work for a popular web-conferencing company where they were told to use the name of the popular city next door. However, a customer messaged the commenter on Facebook to ask for their name, and the company did their best to secure the commenter's identity. The commenter~~The commenter suggests having the customer get a secured credit card to repair the damage caused by the credit card company. They also mention that the customer's manager is not doing their job and that the customer should speak to their manager about the situation. The commenter also expresses frustration with the customer's~~The commenter is frustrated with the lack of common sense in customer service and suggests that the customer may have been confused about the difference between the original price and the coupon. They suggest that the customer should consider taking a team job and discussing their options with a lawyer. The commenter also criticizes companies for",The commenter witnessed a confrontation between a hotel guest and the night manager who refused to upgrade the guest's room to a suite or allow them to stay for free. The commenter sympathizes with the guest's situation and suggests that the hotel should put a loyalty page on their website to avoid any discussion. They also express frustration with the customer's behavior and suggest that the hotel should offer a discount to appease the customer.
11.0,"The commenter had a bad experience with a customer who yelled at them for not being able to provide proper instructions on how to fix their HVAC unit. The customer also complained about not being able to use the company's default TV channel and suggested that the commenter should train them and their staff on the~~The commenter explains that call center staff are often the first point of contact for customers who have issues with their company's website or account. They also mention that some customers may threaten to sue the staff if they are not able to resolve their issues. The commenter also shares a personal experience of working~~The commenter, who used to work as a computer programmer, empathizes with customers who rely on them to fix simple issues. They also express frustration with people who don't know how to use computers or the internet.~~The commenter used to work from home and had many agents with the same issue. They suggest changing out the Ethernet cable if one connects from their work computer to the modem and running a speed test on their work computer to see if the issue persists. They also express frustration with some call center employees who~~The commenter doesn't understand why people prefer a male in tech and believes that a woman can be as good or better than a man. They suggest that the company should offer a credit for the lost value of the product and that the customer service representative should have been more understanding of the customer'~~The commenter suggests that the person who called for help should shut up and do what is asked of them. They also share their experience of working in a small department where male coworkers would demand to speak to a woman because they were sure she couldn't handle their request. The commenter also notes that",The commenter had a bad experience with a customer who yelled at them for not being able to provide proper instructions on how to fix their HVAC unit. The customer also complained about not being able to use the company's default TV channel and suggested that the commenter should train them and their staff on the issue. The commenter also shares their personal experience of working in a small department where male coworkers would demand to speak to a woman because they were sure she couldn't handle their request.
12.0,"The commenter, who has worked in the contact center industry for 30 years, suggests reporting a customer who repeatedly calls and wastes agent's time. The commenter suggests that the customer's security setup may have gone wrong and that they should be able to easily ID their account and password. They also~~The commenter, who works in retail tech support, suspects that a Chrome update may be to blame for the issue. They also mention that when they used to work in a call center, they would always ensure they had a call back number, even if they didn't have access to it.~~The commenter sympathizes with the frustration of dealing with complex and confusing customer service representatives. They express frustration with the inability to reset passwords without a phone call, as well as the lack of communication from the representative. They also mention their own experience of dealing with difficult customer service representatives in the past.~~The commenter used to work for an entertainment company where parents would create accounts for their children and credit cards would be attached to the account. The commenter was impressed with the level of security and mentioned it to the representative after verification, but was frustrated that they couldn't do anything about it themselves.~~The commenter works at a call center for an ISP and often receives calls for email password resets, but they have to verify the caller's ID before they can process any changes. The commenter finds it difficult to answer the first question, as most callers don't understand basic information. They~~The commenter explains that some people have multiple accounts and can only use one for certain services, making it difficult to log them out and logging them back in with the correct login. They also mention that people are allergic to self-service options. The commenter also shares their experience of having to repeat themselves","The commenter, who has worked in the contact center industry for 30 years, suggests reporting a customer who repeatedly calls and wastes agent's time. They suggest that the customer's security setup may have gone wrong and that they should be able to easily ID their account and password. They also mention that when they used to work in a call center, they would always ensure they had a call back number, even if they didn't have access to it. They express frustration with the inability to reset passwords without a phone call, as well as the lack of communication from the representative. They also mention their own experience of dealing with difficult customer service representatives in the past."
13.0,"The commenter used to work in a call center and had a bad experience with a customer who was abusive. The customer complained about the tech's behavior and demanded to know why he didn't finish the job, which the commenter found frustrating. They also shared a personal experience of working at a~~The commenter is frustrated with customers who refuse to pay their bills and misrepresent themselves as the account holder or POA. They also express frustration with customers who refuse to pay their bills and misrepresent themselves as the account holder or POA. The commenter also shares a story about a customer who threatened legal action~~The commenter had a similar experience with a user who said ""fix my computer"" instead of ""fix my cable box."" The commenter had to explain to the user that they couldn't manually reset their modem and that their business account was recommended over a standard account. The commenter also mentions that they~~The commenter shares a story about a customer who claimed she needed to do a settlement on her credit card because she had life insurance money from her husband dying. The commenter also shares a story about a customer who was upset that they wouldn't give her another phone and threatened to cancel her current contract~~The commenter suggests asking the customer how they propose the problem will be solved, as it depends on what the customer wants to do with it. They also criticize the customer's request for a discount on their final bill and suggest that the customer may have misunderstood the situation. The commenter also sympathizes","The commenter used to work in a call center and had a bad experience with a customer who was abusive. The customer complained about the tech's behavior and demanded to know why he didn't finish the job, which the commenter found frustrating. They also express frustration with customers who refuse to pay their bills and misrepresent themselves as the account holder or POA. The commenter also shares a story about a customer who threatened legal action. The commenter suggests asking the customer how they propose the problem will be solved, as it depends on what the customer wants to do with it."
14.0,"The commenter worked in a call center where a woman called to find out why her TV service wasn't working. The commenter found out that the woman's name was actually Carol Jackson and disconnected her account. The commenter suspects that the woman may have been trying to use her deceased mother's~~The commenter used to work in a call center that took bets on horse and dog races and received death threats from people who were desperate to get money for more bets. The commenter's grandmother had always included them in their medical bills, but they were unable to report her to the Better Business Bureau~~The commenter works in tech support and finds it difficult to cancel accounts when customers try to get them to do something they don't want to do. They share a personal experience of dealing with a customer who wanted to cancel their account after their mother's death. The commenter suggests that the customer~~The commenter explains that when they worked for a large phone company in the UK, they were allowed to take payments over the phone from anyone for any account, even if they didn't know how much to pay. They also mention that people who are too old to use computers often don't~~The commenter worked in a bank call center where customers would impersonate their children or other accounts to access the bank's systems. They would warn customers about the potential consequences of going to a debt collection company, but the customer would just say ""I'm not the owner of this account."" The~~The commenter's mother-in-law tried to take advantage of them when they were setting up a new bank account and threatened to move out if they didn't pay their bills. The commenter believes that every call should be recorded and supervisors should be aware of the situation. They also mention","The commenter worked in a call center where a woman called to find out why her TV service wasn't working. The commenter found out that the woman's name was actually Carol Jackson and disconnected her account. The commenter suspects that the woman may have been trying to use her deceased mother's medical bills to get money for more bets. The commenter shares a personal experience of dealing with a customer who wanted to cancel their account after their mother's death. They also mention that people who are too old to use computers often don't. They would warn customers about the potential consequences of going to a debt collection company, but the customer would just say ""I'm not the owner of this account."" The commenter's mother-in-law tried to take advantage of them when they were setting up a new bank account and threatened to move out if they didn't pay their bills."
15.0,"The commenter agrees with the original poster's response to a customer's request for a water heater and suggests that the customer may have had a bad experience dealing with a flooded basement. However, they also express surprise that the customer's request for express delivery was allowed. They also mention that~~The commenter used to work as a phone tech for a tax software company and had to deal with long, frustrating calls from customers who didn't want to be put on hold for a few minutes. The commenter had to leave their job due to depression and had to take unpaid sick leave until they~~The commenter had a bad experience working at a call center and quit after two weeks. They found it difficult to catch people pretending to work and had to deal with customers who were rude and unhelpful. They also mentioned that some companies take longer to process orders than others.~~The commenter states that they are not willing to share their voice space with someone on the phone. They also mention that it can take a second to get back on track after accidentally giving the wrong address. They also mention that in some call centers, the customer's behavior can be difficult to handle~~The commenter works at a bank call center and is frustrated with customers who are rude and disrespectful. They believe that customer service should not be about the employee or the customer, but rather about the customer's experience. They also mention their own experience with a health insurance company where they were treated poorly~~The commenter sympathizes with the original poster's frustration with their company's lack of concern for their health and suggests that the company may be losing business. They also express frustration with the company's lack of communication and suggest that the customer service representative may have exaggerated the severity of the issue","The commenter agrees with the original poster's response to a customer's request for a water heater and suggests that the customer may have had a bad experience dealing with a flooded basement. However, they also express surprise that the customer's request for express delivery was allowed. They also mention that they used to work as a phone tech for a tax software company and had to deal with long, frustrating calls from customers who didn't want to be put on hold for a few minutes. The commenter had to leave their job due to depression and had to take unpaid sick leave until they quit after two weeks. They also mention their own experience with a health insurance company where they were treated poorly. They sympathize with the original poster's frustration with their company's lack of concern for their health and suggest that the customer service representative may have exaggerated the severity of the issue."
16.0,"The commenter had a bad experience with a customer who didn't want to talk to them about their light bulbs. The commenter had to show the customer how to do their job properly, but the customer still didn't want to talk to them. The commenter had to ask for a supervisor and~~The commenter works at a call center that handles 90% of their business during the holiday season. They express frustration with customers who don't respond to emails, chat, or phone calls, as well as customers who complain about the company's policies and practices. They also express frustration with customers who~~The commenter had a customer escalate to a supervisor because they were lying about the only way they could access their account. The commenter explained that they already knew the answer to the security question on the customer's account and did not want to give them unauthorized access. They also criticized the customer's~~The commenter, who works as an unlicensed insurance rep, has been called unprofessional by customers who have missed their payment and their policy is canceled. They express frustration with the customer's behavior and suggest that the customer may have had a bad experience with the company's customer service team. The commenter~~The commenter sympathizes with the customer who lost their keys and notes that it's not the customer's fault if they don't know their own information for their device. They also mention that their company only requires two details when giving out order information, and that the customer's behavior~~The commenter explains that the fixed monotype font used in the post truncates on smaller screens and can't be read. They also mention that packages aren't delivered by USPS or UPS on Sundays. They also mention that their company's chat rating is inaccurate and that they don't","The commenter had a bad experience with a customer who didn't want to talk to them about their light bulbs. The commenter had to show the customer how to do their job properly, but the customer still didn't want to talk to them. The commenter had to ask for a supervisor and had a customer escalate to a supervisor because they were lying about the only way they could access their account. They express frustration with customers who don't respond to emails, chat, or phone calls, as well as customers who complain about the company's policies and practices. The commenter sympathizes with the customer who lost their keys and notes that it's not the customer's fault if they don't know their own information for their device. They also mention that their company only requires two details when giving out order information, and that the customer's behaviorThe commenter explains that the fixed monotype font used in the post truncates on smaller screens and can't be read."
17.0,"The commenter shares a personal anecdote about an elderly couple who called them about their fancy new phone. They explain that they were the most adorable couple of sweet people they've ever had to deal with. The commenter also shares a personal anecdote about an airline customer who lied about having a VPN running and~~The commenter expresses frustration with a customer's behavior and suggests that the person should be fired as a client. They also mention a similar experience where they helped a customer change his password and log into an app, but the customer's behavior made it difficult for them to communicate effectively. The commenter~~The commenter, who used to work in escalations for a cellphone provider, shares their experience of dealing with angry customers who threatened to sue them for not turning on their services. They also express frustration with the older generation's tendency to act like ""lazy, useless, laziest people on~~The commenter explains that it's common for customers to book with multiple airlines and end up at Don Mueang (DMK) instead of the local airport. They also mention that in some cases, airlines will settle disputes before it gets to court. They also mention that their family member is","The commenter shares a personal anecdote about an elderly couple who called them about their fancy new phone. They explain that they were the most adorable couple of sweet people they've ever had to deal with. The commenter also shares a personal anecdote about an airline customer who lied about having a VPN running and suggests that the person should be fired as a client. They also mention a similar experience where they helped a customer change his password and log into an app, but the customer's behavior made it difficult for them to communicate effectively. The commenter also shares their experience of dealing with angry customers who threatened to sue them for not turning on their services. They also express frustration with the older generation's tendency to act like ""lazy, useless, laziest people onThe commenter explains that it's common for customers to book with multiple airlines and end up at Don Mueang (DMK) instead of the local airport."
18.0,"The commenter believes that the person who got their arm run over in a call center would have to press charges in order for the incident to be reported. They also express frustration with customers who try to take advantage of call center staff. They also share a personal experience of a cemetery worker wearing a mask~~The commenter criticizes the behavior of a customer who repeatedly called and abused an agent, and suggests that the customer should have been banned from the call center for their behavior. They also suggest that the customer should have been charged for the cost of the callouts, and that the customer should have been~~The commenter sympathizes with the person who had a difficult interaction with a call center agent during a difficult time in their life. They suggest that the call center agent should try to avoid negative interactions with customers as it can lead to negative thoughts. They also share a personal experience of not being able to~~The commenter suggests that the person in the story may have overreacted to a small issue. They also mention that they used to work for British Gas and had to deal with a lot of frustrated customers who didn't know how to use their own gas meters. They also mention that the person in~~The commenter states that their local supplier is following Covid guidelines and that if they get a card through the door, they can email them their own reading within 24 hours and get an accurate bill. They also mention that they have never had a meter reader or missed call card since moving to the UK","The commenter believes that the person who got their arm run over in a call center would have to press charges in order for the incident to be reported. They also express frustration with customers who try to take advantage of call center staff. They criticize the behavior of a customer who repeatedly called and abused an agent, suggest that the customer should have been charged for the cost of the callouts, and sympathize with the person who had a difficult interaction with a call center agent during a difficult time in their life. They also mention that they used to work for British Gas and had to deal with frustrated customers who didn't know how to use their own gas meters."
19.0,"The commenter advises against telling customers to ""Fuck Off"" or ""Kiss Their Ass"" as it could lead to negative consequences. They also mention that customers often assume that the higher up the chain will be sympathetic, but in reality, it's not always the case. They also mention~~The commenter had a customer who repeatedly interrupted them while they were trying to resolve her issue. The commenter calmly explained that they understand how frustrating it can be to be cut off repeatedly and that they are willing to escalate the issue to a higher level if necessary. The commenter also mentioned that they have had~~The commenter had to deal with a customer who refused to agree to an online banking agreement. The commenter sympathized with the customer's frustration but said they would not change the agreement. The commenter also shared a personal experience of dealing with a customer who threatened to kill the commenter's co-~~The commenter had a bad experience with a contractor who was yelling at them and trying to give them serial numbers as ""OLOLOLOLOOO"" instead of their legal name. They also had a bad experience with a customer who threatened to shoot himself if they didn't release him from his contract.~~The commenter expresses frustration with customers who demand a supervisor and refuse to listen to the supervisor's explanation. They also mention their own experience of working in collections and how difficult it can be to deal with angry customers.~~The commenter, who used to work in a high-street bank's customer complaints department, expresses frustration with customers who demand to speak to the CEO of a multinational company because of a technical issue. They also share a personal experience of being called a ""whitebread honkey"" by a customer","The commenter advises against telling customers to ""Fuck Off"" or ""Kiss Their Ass"" as it could lead to negative consequences. They also mention that customers often assume that the higher up the chain will be sympathetic, but in reality, it's not always the case. They share a personal experience of being called a ""whitebread honkey"" by a customer."
